<?xml version="1.0" encoding="UTF-8"?>
<!--Sample XML file generated by XMLSpy v2007 sp2 (http://www.altova.com)-->
<Order xmlns:xsi="http://www.w3.org/2001/XMLSchema-instance" xsi:noNamespaceSchemaLocation="Order_demo.xsd">
	<OrderType>SO</OrderType>
	<Header ShipTo="3004">
		<Company>00200</Company>
		<BusinessUnit>M30</BusinessUnit>
		<SoldTo>3003</SoldTo>
	</Header>
	<items>
		<item>
			<ID>7150</ID>
			<Quantity>3</Quantity>
		</item>
		<item>
			<ID>7000</ID>
			<Quantity>1</Quantity>
		</item>
		<item>
			<ID>7183</ID>
			<Quantity>3</Quantity>
		</item>
		<item>
			<ID>7152</ID>
			<Quantity>2</Quantity>
		</item>
	</items>
</Order>
